id;parent_id;name;description;active;position;
"3";"2";"Каталог товарів";"Наші рослини сміливо висаджуйте в будь-яку пору року, і навіть влітку!

Розсадник «Зелені Янголи» пропонує широкий асортимент рослин власного виробництва. Всі наші рослини адаптовані до українських кліматичних умов та високої якості.
Купуйте рослини з доставкою в будь-яку точку України!  Спеціальна упаковка, якість якої підтверджено тисячами успішно доставлених рослин дозволяє пересилати рослини навіть влітку.
Наша технологія вирощування рослин забезпечує швидку адаптацію на новому місці  та уникнення стресу при пересадці !

Дізнатись більше     Інструкція по пересадці

Вітаємо всіх любителів рослин!";"1";"0";
"357";"2";"Знижки та акції";"";"1";"1";
"285";"2";"Імпорт";"Найкращі імпортовані рослини високої якості за найнижчими цінами ви можете придбати в м. Ужгороді (вул. Оноківська - Об'їздна) або з доставкою в будь-яку точку України";"1";"2";
"42";"3";"Хвойні дерева та кущі";"Хвойні рослини мають велику цінність для ландшафтного дизайну – їх вічнозелена хвоя завдяки мутаціям і селективному виведенню набуває різноманітних відтінків – від зелено-блакитного до золотисто-жовтого. Хвойні використовуються як окремі рослини, у формуванні живих загорож, карликові види чагарників також використовуються як грунтоукривні рослини. Більшість видів декоративних хвойних рослин добре гармонують як з зеленим газоном так і з кам’янистими елементами дизайну, а також з штучними та природними водоймами.
Розсадник «Зелені янголи» пропонує широкий асортимент хвойних рослин як у контейнерах так і викопні з грунту рослини, які завдяки сучасній технології пакування можуть пересаджуватися не тільки навесні і восени, а і у літній період за умови швидкої доставки. Весь асортимент саджанців і повномірів хвойної продукції нашого виробництва за найнижчими цінами може бути доставлений в будь-яку точку України!";"1";"0";
"55";"3";"Листяні дерева";"Широкий асортимент листяних дерев екзотичних порід, що стануть справжними домінантами ваших парків та ландшафтних композицій, насадки алей. Високі декоративні якості наших елітних видів дерев з нашомого розсаднику гарантуються. Ми доставляємо елітні дерева для ландшафтного дизайну, парків, алей за низькими цінами в Ужгороді та по Україні (Київ, Львів, Харків, Херсон, Дніпро, Запоріжжя, Одеса та ін).

 Глід (Crataegus) 
";"1";"1";
"53";"3";"Листяні кущі";"Листяні декоративні рослини об'єднують собою велику кількість гарних дерев та кущів, котрі як правило скидають листя взимку. Багато з них мають високі естетичні якості кори стовбурів, цікаві кольорові відтінки листя, мають гарний цвіт, у деяких є декоративні плоди, що довго тримаються.
Ви можете купити високоякісні адаптовані листяні декоративні рослини з доставкою по Україні у нашому інтернет магазині. Доставка здійснюється у Київ, Львів, Харків, Дніпро, Запоріжжя, Херсон, Одесу, Луцьк, Івано-Франківськ, Чернівці, Хмельницький та інші населені пункти службою поштової доставки.

 ";"1";"2";
"11";"3";"Ліани";"Ліани класифікація і опис
Рослини, що в’ються або ліани – вони можуть бути дерев’янисті, мати опадаюче чи вічнозелене листя, можуть бути трав’янистими, а також або багаторічні або однорічні.
Дерев’янисті ліани щороку починають квітнути навесні фактично з того місця де були, а трав’янисті на зиму відмирають і заново ростуть від коренів.
Ліани не мають можливості самі рости без опори, знаходять її завдяки вусикам чи придаточним кореням. Стебла ліан гнучкі і видовжені, їм характерний досить швидкий ріст. Завдяки цьому ліани піднімаються високо вверх і там розпускаються листя і квіти.
Використання ліан у ландшафтному дизайні
За допомогою ліан можна прикрасити будь-яку ландшафтно-архітектурну форму. Ліани можна використати для прикрашення паркану, альтанок, стін. Для них можна збудувати спеціальні опори і зробити чудовий затінок.
Доставка і покупка ліан
У розпліднику рослин ландшафт-центру «Зелені Янголи» в м. Ужгород можна придбати декоративні ліани за найкращою низькою ціною і також можлива доставка у всі регіони України службою доставки.
У нашому інтернет магазині Ви можете купити ліани - однорічні та багаторічні садові ліани з доставкою по Україні.
  ";"1";"3";
"248";"3";"Верескові рослини";"Вересові рослини це вічнозелені чагарники, дерева, ліани. У нас ви можете придбати широкий асортимент саджанців і повномірів декоративних представників родини вересових. Це і азалії (рододендрони), еріка, верес звичайний. В ландшафтному дизайні вересові добре комбінуються з хвойними рослинами і можуть використовуватися для контрастних композицій, кам'янистих ладшафтах, японських садках, затінених куточках. Вересові рослини добре виглядають у групових посадках.
Ми продаємо і доставляємо саджанці вересових в усі міста України (Харків, Київ, Полтаву, Львів, Луцьк, Хмельницький, Івано-Франківськ, Чернівці, Вінницю, Чернігів, Дніпро, Запоріжжя, Херсон, Одесу) або ви можете їх купити прямо у нас в розпліднику в Ужгороді.";"1";"4";
"48";"3";"Багаторічники, трави";"Багаторічні квітучі рослини і трави дозволяють створювати контрастні композиції у ландшафтному дизайні, робити більш цікавими скельні гірки, клумби та ін. Розплідник декоративних рослин "Зелені янголи" пропонує багаторічники і трави в асортименті за низькими цінами в місті Ужгород та з доставкою по Україні";"1";"5";
"65";"3";"Квіти і гарноквітнучі";"Квіти і гарноквітнучі рослини використовуються в ландшафтному дизайні для оформлення клумб, бордюрів, скелястих гірок, водойм та ін. Широкий асортимент адаптованих квітів власного виробництва з розсадника ландшафт центру "Зелені Янголи" в Ужгороді та з доставкою по Україні. Ми гарантуємо високу якість наших рослин.









 






";"1";"6";
"41";"3";"Альпійські, грунтопокривні";"Альпійські та грунтопокривні рослини використовуються для створення контрасту з газонами в різномінітних ландшафтних композиціях, роблять ділянку більш цікавою і яскравою. В сезон цвітіння гарний яскравий цвіт радує очі, а квіткові аромати наповнюють повітря. Широкий асортимент з нашого розсадника ландшафт центру "Зелені Янголи" в місті Ужгород за низькими цінами та з доставкою по всій Україні.


";"1";"7";
"44";"3";"Плодові та ягоди";"Плодові та ягідні рослини за найнижчими цінами в Ужгороді та з доствкою по Україні";"1";"8";
"297";"3";"Вкорінені живці";"
Рекомендуємо мульти-касети з вкоріненими живцями для людей з професійним досвідом дорощування, або для тих, хто хоче спробувати поекспериментувати, оскільки за вкорінені живці потребують особливих умов: постійний догляд, пересадка у більший контейнер, щоденний полив і т. д. 
Увага! 

Вкорінені живці не підходять для висадки у відкритий грунт. Краще обрати саджанці в більшому розмірі - горщик Р9 (0,5л) наприклад.
Не всі живці в мульти-касеті можуть мати корінь, для мульти-касет вважається нормою до 10% відпаду живців.

";"1";"9";
"331";"3";"Пряні трави ";"Пряні трави - багаторічні трави з вираженим ароматом - для кулінарії, приготування напоїв та десертів.";"1";"10";
"1328";"3";"Рослини на штамбі";"Рослини на штамбі – купити штамбові дерева та кущі в Україні
Рослини на штамбі – це декоративні дерева та кущі, сформовані на високому стовбурі, які додають вишуканості та структури вашому саду. Вони ідеально підходять для озеленення прибудинкових територій, парків, алей та клумб.
Переваги штамбових рослин
✅ Естетика – надають саду доглянутий вигляд.✅ Компактність – займають мало місця, що важливо для невеликих ділянок.✅ Універсальність – підходять для посадки в відкритий ґрунт та контейнерне вирощування.✅ Різноманітність – вибір серед декоративних та плодових рослин.
Популярні види штамбових рослин
Штамбові хвойні та листяні дереваПлодові дереваДекоративні кущі
Як вибрати рослину на штамбі?
Визначте розмір штамбу – низький (40-60 см) або високий (100-150 см).Врахуйте морозостійкість для вашого регіону.Підбирайте відповідний догляд – регулярна обрізка підтримує гарну форму.
Де купити штамбові рослини?
У нашому інтернет-магазині Landshaft.info ви знайдете великий вибір штамбових рослин гарної якості та з доставкою по всій Україні. 
Замовляйте рослини на штамбі онлайн та створюйте унікальний ландшафт у своєму саду!";"1";"11";
"398";"3";"Топіари (Стрижені Форми)";"";"1";"12";
"402";"3";"Набори рослин";"";"1";"13";
"369";"3";"Насіння декоративних рослин";"";"1";"14";
"407";"3";"Подарункові сертифікати";"Подарунковий сертифікат від "Зелених Янголів" - це те, що гарантовано сподобається любителям рослин!
Переходьте до карточки сертифікату та обирайте потрібний номінал.
";"1";"15";
"1305";"3";"Крафтова продукція";"";"1";"16";
"81";"3";"Добрива";"Широкий асортимент добрив для гарного росту рослин ви можете придбати в м. Ужгород (вул. Оноківська-Об'їздна, 1) або з доставкою в любу точку України ";"1";"17";
"93";"3";"Грунти і торфосуміші";"Спеціальні грунти і торфосуміші для вирощування декоративних рослин за низькою ціною в м. Ужгород або з доставкою по Україні";"1";"18";
"98";"3";"Засоби захисту";"Засоби захисту рослин від шкідників та хвороб за найнижчими цінами в місті Ужгород з доставкою по Україні";"1";"19";
"62";"3";"Садовий інструмент";"";"1";"20";
"1367";"3";"Рослини для зимового саду";"";"1";"21";
"1369";"3";"Кашпо і горщики";"";"1";"22";
"1384";"3";"Однорічники";"";"1";"23";
"180";"11";"Акебія (Akebia)";"";"1";"0";
"249";"11";"Гліцинія (Wisteria)";"Гліцинія яку також називають вісте́рія (лат. wistéria) - це рід ліаноподібних дерев'янистих гарноквітучих рослин з сімейства бобові.Головна декоративна особливість вістерії це прекрасні ароматні суцвіття довжиною 10 - 30 см, переважно бузкового кольору, хоча зустрічаються також гліцинії з рожевими, білими квітами.
Гліцинія найкраще росте і цвіте в захищених, теплих, сонячних місцях, в помірно родючих та помірно вологих ґрунтах. 
Ідеально підходить для посадки біля фасадів будівель, альтанок, пергол за умови, що опорна конструкція буде довговічною та здатна утримувати значну вагу пагонів та листя навіть після сильного дощу.";"1";"2";
"245";"11";"Дівочий виноград (Parthenocissus)";"Дівочий виноград – це декоративна ліана. Не варто плутати з їстівним виноградом! Так як дівочий виноград вирощують тільки в декоративних цілях. За допомогою цієї рослини закривають непривабливі споруди, прикрашають стіни та альтанки. Дівочий виноград не вибагливий в догляді, може зростати на будь-якій місцевості. В залежності від сорту може мати різне забарвлення листя. ";"1";"3";
"162";"11";"Жимолость";"Жимолость – багаторічний листяний чагарник. Деякі види мають форму ліани і використовуються тільки в декоративному садівництві. А деякі можуть плодоносити. Такі види цінують за їх корисні властивості та чудовий смак. Багато видів жимолості дуже часто висаджують в садах, уздовж алей, використовують для групових посадок. В залежності від сорту, форма та колір рослин можуть відрізнятися. ";"1";"4";
"350";"11";"Кампсис (Campsis)";"";"1";"5";
"1239";"11";"Кірказон (Aristolochia)";"";"1";"6";
"1336";"11";"Лимонник (Schisandra)";"";"1";"7";
"256";"11";"Клематис (Clematis)";"";"1";"8";
"1253";"11";"Пасифлора (Passiflora)";"";"1";"9";
"1300";"11";"Трахелоспермум (Trachelospermum)";"";"1";"10";
"254";"11";"Плющ (Hedera)";"Плющ або хедера (Hedera) – вічнозелена ліана із сімейства аралієвих, яка налічує близько 15 видів. В природі плющ зустрічається в тінистих лісах, де він може обплітати дерева своїми довгими пагонами і досягягати висоти понад 10 м. Корінці-присоски допомагають чіплятися за опору або проникають у грунт, що дає рослині додакове живлення та сприяє активному росту.
Хедера невибаглива до грунту, але вологолюбива рослина - її коренева система поверхнева, тому у теплий період року полив має бути регулярний та рясний. Зелені плющі прекрасно переносять напівтінь і тінь, а ось варієгатні та яскраві кольорові різновиди найкраще саджати освітленому місці, притіняючи від прямого сонячного проміння.
Не всі представлені різновиди плющів морозостійкі. Кольорові форми плюща, як правило, більш теплолюбиві, і рекомендуються для висадки у тепліших регіонах України (частина Закарпатської та Львівської, Одеська, Миколаївська, Херсонська область), або у якості кімнатної рослини.  Для Київської, Харківської, Сумської областей рекомендується висаджувати зелені плющі у затишні, захищені від вітру і протягів місця.
Плющ широко використовується у декоративному садівництві - з його допомогою можна легко та швидко реалізувати різноманітні варіанти вертикального озеленення: - озеленення стін, фасадів будинків і прибудинкових споруд;- сітка завита плющем утворює зелену огрожу, яка захистить від пилу та збагатить повітря киснем;- арки, обвиті плющем виглядають дуже ефектно!Щоб отримати зелену стіну радимо саджати плющ кожні 30 см.
Плющ може стати альтернативою традиційного газону - він швидко утворить густий, тіньовитривалий, вічнозелений килим, який не дасть розповсюдитися бур'янам! Радимо саджати плющ на відстані не менше ніж 50 см від стовбурів дерев. Щоб отримати щільне покриття на 1 метр квадратний висаджуйте 6 саджанців плюща.
Плющ також використовується у якості кімнатної рослини. В такому випадку не забувайте регулярно поливати вологолюбивий плющик, не допускайте пересихання грунту.
Якщо ви спостерігаєте пожовтіння листочків плюща - можливо це наслідок рясного поливу при низьких температурах, чи надлишок добрив.Якщо у вас кольоровий різновид плюща, а листя стало зелене - це може бути наслідком недостатнього освітлення.Коричневі або сухі кінчики листя - наслідок сухого повітря, дії прямого сонячного проміння або недостатнього поливу.Якщо пагони вкриває невелика кількість листочків - плющу не вистачає сонця.
Купуйте якісні саджанці плюща у провідного українського розсадника декоративних рослин "Зелені Янголи" з доставкою по Україні!";"1";"11";
"1245";"11";"Фалопія (Fallopia)";"";"1";"12";
"37";"16";"Рослини для напівтіні та тіні";"Рослини для напівтіні та тіні
В саду часто є місця, навіть якщо в ньому ще нема великих дерев, де сонячного світла протягом дня дуже мало або воно є тільки нетривалий час - тіньові зони від будівель, під дахом, балконом.
В сильнозатінених місцях, наприклад, під великими деревами, в закритих дворах-колодязях, у північної стіни будівлі, можуть рости лише деякі, дуже ретельно підібрані види. Тінелюбиві рослини частіше мають темно-зелене блискуче листя. Слід виключити з планів посадки до таких місць рослини з строкатим або різнокольовим листям - в тіні вони втрачають колір. Для напівтіні, де сонячного світла більше чи воно розсіяне підходять всі вказані нижче рослини.";"1";"0";
